"id","type","language","text","label","risk_level","risk_points","manipulation_methods","personal_data_risk","payment_risk","safe_action","source","license_note","can_be_public_demo"
"T001","fake_delivery","zh-TW","您的包裹因地址不完整無法配送，請於今日內至物流通知中心補填資料並繳交手續費。點擊連結完成驗證。","scam","high","急迫語氣;要求補資料;要求小額付款;可疑連結","製造急迫感;小額付款誘導;冒充物流單位","可能要求姓名、電話、地址或驗證碼","可能導向假付款頁","不要點擊連結；改至官方物流網站查詢；不要輸入信用卡資料","self-made","自製泛稱案例","true"
"T002","school_it_notice","zh-TW","校園 IT 服務將於週五 22:00 至 23:00 進行系統維護，期間登入服務可能短暫中斷。若有問題請洽資訊服務窗口。","legitimate","low","系統維護通知;無要求登入;無付款要求","無明顯詐騙話術","無明顯個資風險","無付款風險","可從學校官方網站或公告系統確認","self-made","自製泛稱案例","true"
"T003","fake_bank","zh-TW","某某銀行提醒您，您的帳戶因安全異常已被暫停，請立即登入以下連結完成身分驗證，否則將限制交易功能。","phishing","high","冒充銀行;威脅停權;要求登入;可疑連結","冒充權威;恐嚇停權;製造急迫感","可能要求帳號、密碼、OTP 或身分證字號","可能導向假銀行登入頁","不要使用訊息內連結；改用官方 App；聯絡銀行客服","self-made","自製泛稱案例","true"
"T004","ambiguous","zh-TW","您的帳戶有一筆異常登入紀錄，若非本人操作，請確認帳戶安全設定。","suspicious","medium","資訊不足;提到異常登入;未提供明確來源","安全焦慮誘導","可能引導使用者後續提供帳戶資訊","目前未直接要求付款","先確認寄件者與官方來源；不要回覆個資","self-made","自製泛稱案例","true"
"T005","normal_notification","zh-TW","您的訂單已完成出貨，預計 2 至 3 個工作天送達。可至原購物平台訂單頁查看配送狀態。","legitimate","low","一般出貨通知;無外部可疑連結;無要求付款","無明顯詐騙話術","無明顯個資風險","無付款風險","從原購物平台查詢即可","self-made","自製泛稱案例","true"
"T006","fake_government","zh-TW","交通服務網通知：您有一筆罰鍰尚未繳納，逾期將加收滯納金。請立即點擊連結完成線上繳費。","scam","high","冒充政府服務;罰鍰威脅;要求線上付款;可疑連結","冒充權威;恐嚇罰款;製造急迫感","可能要求身分證字號、車牌或聯絡資料","可能導向假繳費頁","不要點擊簡訊連結；改從官方網站查詢罰鍰","self-made","自製泛稱案例","true"
"T007","line_message","zh-TW","您好，我們正在招募線上兼職人員，每天只要 10 分鐘即可獲得高額報酬，名額有限，請加入群組了解。","scam","high","高報酬承諾;陌生邀請;要求加入群組","利益誘惑;製造稀缺感;引導私下聯絡","可能後續要求提供帳戶或身分資料","可能誘導保證金或投資付款","不要加入陌生投資或兼職群組；不要提供帳戶資料","self-made","自製泛稱案例","true"
"T008","legitimate_email","zh-TW","帳戶安全中心提醒您，近期建議定期更新密碼。請自行開啟官方 App，於設定頁面完成密碼變更。","legitimate","low","安全提醒;未附連結;要求自行開啟官方 App","無明顯詐騙話術","低風險，未要求回覆個資","無付款風險","可自行開啟官方 App 檢查設定","self-made","自製泛稱案例","true"
